U1887	Energy Storage Control Module (ESCM) Lost Communication With Starter/Generator Control Module (SGCM)
U1888	Hybrid Control Module (HCM) Lost Communication With Energy Storage Control Module (ESCM)
U1889	Hybrid Control Module (HCM) Lost Communication With Body Control Module (BCM)
U1890	Hybrid Control Module (HCM) Lost Communication With HVAC Control Module
U1891	Hybrid Control Module (HCM) Lost Communication With Instrument Panel Cluster (IPC)
U1892	Hybrid Control Module (HCM) Lost Communication With Electro-Hydraulic Power Steering (EHPS) Module
U1893	Hybrid Control Module (HCM) Lost Communication With Powertrain Control Module (PCM)
U1894	Hybrid Control Module (HCM) Lost Communication With Starter/Generator Control Module (SGCM)
U1895	Electro-Hydraulic Power Steering (EHPS) Module Lost Communication With Powertrain Control Module (PCM)
U1896	Electro-Hydraulic Power Steering (EHPS) Module Lost Communication With Starter/Generator Control Module (SGCM)
U1897	Starter/Generator Control Module (SGCM) Lost Communication With Energy Storage Control Module (ESCM)
U1898	Starter/Generator Control Module (SGCM) Lost Communication With Hybrid Control Module (HCM)
U1899	Starter/Generator Control Module (SGCM) Lost Communication With Powertrain Control Module (PCM)
U2099	High Speed Communication Enable Circuit
U2100	CAN Bus Communication Malfunction
U2102	More Controllers On BUS Than Programmed
U2103	Fewer Controllers On The Bus Than Programmed
U2104	CAN Bus Reset Counter Overrun
U2105	Lost Communication With The Engine Control System
U2106	Lost Communication With Transmission Control System
U2108	Lost Communication With Electronic Brake Control Module
U2150	Navigation ECU Gateway Communication Error
U2151	Navigation ECU Communication Malfunction
U2153	VICS ECU Communication Error
